{
  "schema": "ghrab-material-v1",
  "id": "demo-school-email",
  "version": 1,
  "title": "Oznámení o změně termínu",
  "subject": "Společné",
  "yearGroup": "Učitelé",
  "level": "Učitelé",
  "language": "cs",
  "objectives": ["Ukázat přenositelnost materiálu mezi nástroji."],
  "content": {
    "sourceText": "Anonymní šablona věcného a diplomatického školního e-mailu.",
    "vocabulary": [],
    "tasks": []
  },
  "differentiation": {},
  "quality": {
    "status": "teacher-reviewed",
    "reviewedAt": "2026-07-10"
  },
  "provenance": {
    "demo": true,
    "containsPersonalData": false
  }
}
