{
  "schema": "ghrab-material-v1",
  "id": "demo-past-simple",
  "version": 1,
  "title": "Past Simple: The unexpected journey",
  "subject": "Anglický jazyk",
  "yearGroup": "B1",
  "level": "B1",
  "language": "cs",
  "objectives": [
    "Ukázat přenositelnost materiálu mezi nástroji."
  ],
  "content": {
    "sourceText": "Materiál se třemi úrovněmi podpory a společným cílem.",
    "vocabulary": [],
    "tasks": []
  },
  "differentiation": {},
  "quality": {
    "status": "teacher-reviewed",
    "reviewedAt": "2026-07-10"
  },
  "provenance": {
    "demo": true,
    "containsPersonalData": false
  }
}
