{
  "schema": "ghrab-material-v1",
  "id": "demo-czech-syntax",
  "version": 1,
  "title": "Vedlejší věty v souvětí",
  "subject": "Český jazyk",
  "yearGroup": "2. ročník",
  "level": "2. ročník",
  "language": "cs",
  "objectives": [
    "Ukázat přenositelnost materiálu mezi nástroji."
  ],
  "content": {
    "sourceText": "Ukázka práce s rozpoznáním a převodem typů vedlejších vět.",
    "vocabulary": [],
    "tasks": []
  },
  "differentiation": {},
  "quality": {
    "status": "teacher-reviewed",
    "reviewedAt": "2026-07-10"
  },
  "provenance": {
    "demo": true,
    "containsPersonalData": false
  }
}
